0.0,OUSLEY.txt-500,"The record of his life is one of unostentatious goodness and unobtrusive earnestness in the performance of appointed labour. He was the only son of the Right Hon. Sir Gore Ouseley, the eminent Oriental scholar, who was successively Ambassador and Minister Plenipotentiary to Persia and St. Petersburgh, by his marriage with Harriet Georgina, daughter of Mr. John Whitelocke. He was born in London in August, 1825, consequently he was in the sixty^ fourth year of his age at the time of his death. He was called Frederick after the Duke of York, and Arthur after the Uuke of Wellington, his godfathers. "
0.0,PILGRIM.txt-501,"<p>In 1881 I began to attend some of the great Musical Festivals, going to Worcester as the guest of the Dean, Lord Alwyne Compton; also undertaking the onerous task of writing an account of the proceedings for the Press, a tiresome and fatiguing duty which I never tried to do again. But it was a very pleasant time. One of my fellow guests was Dr. Stone, a wellknown amateur who played the contra-fagotto* at the Festival, and we made a good deal of music at the Deanery. Dr. Stone's instrument was an enormous affair (Santley once told him that it resembled the stand-pipe at Chelsea Waterworks!). We arranged a duet for contra-fagotto and piano, the theme being that of the well-known round, ""Three blind mice."" Stone played the tune at an incredible depth, and my part was to demonstrate the scamperings of the mice. The composition had a great success. It was never printed, nor do I think there is any record of its performance in the annals of the Festival.</p>"
0.0,PILGRIM.txt-502,"Most of my life has been devoted (though not exclusively) to the service of the Church. As boy and man I have served under seven Deans, I have worked with eleven Precentors, while Canons, Vicars-Choral, and Choristers are too numerous to mention. Outside the Church I have laboured at my Profession as Conductor, Teacher in Colleges, Lecturer, and University Professor. In all these various ways I have tried to serve the cause of Music. Whether I have done all that in me lay, readers of the following pages must decide. But, at any rate, I can conscientiously say I have done my best to fulfil worthily the duties of any position to which I have been called. "
0.0,PILGRIM.txt-503,"<p>Hall&eacute; was a great musical power at Manchester, and deservedly so. He had established a fine orchestral and choral force, and gave concerts of first-class importance every week at Manchester and in many of the great Northern towns. He was an excellent conductor, without any tricks or oddities. As a conductor of choral music he was just as successful as with the orchestra, which is not always the case. He did not train the choir, that being done for him by a chorus-master of splendid energy and resource, Charles Hecht. The choir worshipped Hall&eacute;, the Lancashire lads and lasses coming entirely under his sway. I think he was never nonplussed but once. This was during one of the many performances of Berlioz's ""Faust"" (a work that Hall&eacute; had really restored to life, at least in England). In the well known Serenade for Mephistopheles there is a dramatic and dangerous part for the choir, who have to come in with a sudden satirical ""Ha !"" in the course of the song. An enthusiastic tenor in the choir was always very alert and on the spot to those who watched him, as I often did. But on this occasion he was a little too alert, and just a moment before the whole choir should enter, he came in alone with a loud nasal ""Ha !"" The effect was fearful, the choir could hardly go on, the audience were convulsed, and Hall&eacute; well he would have killed the man, I am sure, if he could, and he tried to do so with his eye. I never saw that tenor again, some say he emigrated.</p>"
0.0,PILGRIM.txt-504,"THE Canterbury Pilgrims, many years ago, probably passed through the streets or in the immediate neighbourhood of the old City of Rochester as they wended their way to and from the Shrine of Thomas a Becket. Their journeys lay through a diversified and beautiful country, and though toilsome could not have been without many happy days. Through the streets of the same old City of Rochester, nearly seventy years ago, I used to pass to and fro to attend to my duties at the Cathedral, starting on the Pilgrimage recorded in the following pages. My journey has been a long one, my experiences very diversified. I have had as companions, like the Canterbury Pilgrims, a varied Company of all Professions and Ranks of Men. My life's work has been attended with many joys and some sorrows, yet my days have not been really toilsome, and I have indeed been happy in my opportunities. The notes of my life which I have been tempted to put on record contain nothing very remarkable, of that I am quite conscious. But the duties which have fallen to me in connection with many important functions at the Abbey will be of some little interest to my friends at least. And possibly the story of my career may be an encouragement to some boy or boys in Cathedral Choirs upon whom in due time the care of our Cathedral Music may devolve."
0.0,PILGRIM.txt-505,"<p>An irreverent interruption was caused on one occasion when a demonstration of working men marched from Trafalgar Square into the South Transept. But after all they were not very unruly, and listened with interest and some appreciation to Wesley's ""Wilderness."" The Suffragettes were a little more unreasonable at times, and frequently I had powerfully to intervene with the organ to cover up their remarks.</p>"
0.0,PILGRIM.txt-506,"Duke of Wellington's Funeral Rochester Cathedral Mr. J. L. Hopkins Private Theatricals A Barrel of Apples A Caning Incident Mr. Miles An Ingenious Use of a Mirror Joseph Maas Launch of the "" Cressy "" Landing of Princess Alexandra at Gravesend An Ideal Precentor. "
0.0,PILGRIM.txt-507,"<p>Dr. Maclean made some graceful references to our service at the Abbey, and to me. I venture to give an extract : ""Sir Frederick Bridge, whose energy is inexhaustible in illustrating the great features of his country's music, and to whom every anniversary is a festal day, marked St. Peter's Day with functions at the Abbey commemorative of S. S. Wesley's birth-centenary. Along with the religious service for the day, eight of the great anthems were sung in the Nave by a choir of two hundred and fifty, with organ accompaniment (Alcock), but conducted from a rostrum (Bridge), and so rendered with vigour and expression. The effect was supremely impressive Later an organ-recital of eight of the S. S. Wesley organ-works by eight different organists, the most effective being Choral Song and Fugue (Kendrick Pyne) and National Anthem with Fugue (Bridge) . . .""</p>"
0.0,PILGRIM.txt-508,"When he wrote ""The Pickwick Papers"" Dickens was quite a young man, but he evidently knew the Cathedral of Rochester very well, as is evidenced by his allusion to the steps worn by pilgrims' feet, and later in the same sentence to ""Jerkins too matchlocks."" These worn steps led up to the Chapel of St. William of Perth, the patron saint of the city, who it is said was murdered near Rochester in the I3th century, while on a pilgrimage from Scotland to the Holy Land. During the centuries his shrine became a resort for pilgrims, and in this same Chapel I was often allowed to look at a soldier's equipment comprising a buff jerkin and a matchlock, which were preserved in a case."
0.0,PILGRIM.txt-509,"<p>A VERY interesting experience which came to me in my early years at the Abbey was the opportunity of meeting Lord Tennyson. As already mentioned, when living at Windsor I had made a musical setting of ""Christmas Bells,"" a poem from ""In Memoriam,"" and this being sung in the Abbey at Christmas-time had attracted the attention of a friend of Lord Tennyson, Mr. Baillie-Hamilton. He had also heard privately a performance of a setting of mine of Tennyson's humorous poem, ""The Goose."" Through Mr. Baillie-Hamilton's introduction, I got to know the Hon. Hallam Tennyson, and it was decided that the two settings should be performed at an evening party at the house of Lord Tennyson in Eaton Square. I took a portion of the Abbey choir with me, and we sang these two compositions before a large company. ""The Goose,"" with its humorous words, and, I think, fairly humorous music, seemed to please the audience very much. Indeed, I know it gave satisfaction to the Poet in one point.There is a verse in the poem describing the old owner of the goose getting prosperous with the results of her poultry-keeping, and the lines run : And feeding high and living soft Grew plump and able-bodied, Until the grave churchwarden doffed, The parson smirked and nodded. This is set in a mock sentimental way, and it produced considerable merriment, the Poet saying in my hearing, evidently with some satisfaction, ""That 's the poem the critics said showed I had no sense of humour."" It seemed to me that he had for the first time been quite easy in his mind on this subject. Another observation which I must record also came from the Poet in connection with this song. Mr. Frederick Locker, who was one of the guests, and himself a poet of no mean order, congratulated me before Tennyson on the way in which I had set the words, saying: ""I hope that your name will go down to posterity associated with the poem and its author."" ""In fact,"" added Tennyson, ""the current of my poetry will be Bridged"".</p>"
0.0,PILGRIM.txt-510,"I cling tenaciously to every remembrance of my childhood days at Rochester. For me the change from the Midlands to the ancient city on the Medway was a delightful experience. The neighbourhood of Rochester was then quite rural and very picturesque with its numerous hop-gardens and cherry orchards. It was a custom at my home for the children to be taken to the hop-gardens during the hop-picking season, to spend a happy day. The hop-pickers in those days were mostly poor people from Rochester, many of whom my parents knew. The migrant crowds from London were not then a feature. We would take up our station with, I suppose, the capriciousness of children, beside the bin at which some poor woman would be picking, and devote ourselves to what was for us the delightful game of picking hops. By this means we amused ourselves, and added to her earnings. The days spent in those gardens have a treasured corner in my memory. But possibly we enjoyed ourselves even more in the cherry orchards than in the hop-gardens. Our excursions were generally made to an orchard owned by a friend at Gillingham (then a village, now a large town), one or more fellow choristers making up our party. It was all a fruit-growing country, stretching from here to Faversham. The delight of us boys at being allowed to climb ladders into the very heart of the trees, and eat as many cherries as we could (and sometimes, I fear, more than were good for us), may be imagined. Those black-hearts and bigaroons are a luscious memory. I recollect we resolved artful boys that we were to throw the stones, if possible, into the next field so that our host would not know how many we consumed. The subtlety of this little trick has been in my mind more than once in later years, when I have been shooting grouse and probably expending a great many more cartridges than was justified by the few birds there were to show for so much ammunition. On several occasions I have been tempted to resort to a furtive strategy, and hide my failure by distributing the empty cartridge-cases as remotely as possible in the heather!"
0.0,PILGRIM.txt-511,"<p>At the postponed Coronation all went well, the Litany being sung early in the proceedings on the steps of Henry VII.'s Chapel by the Bishop of Oxford and the Bishop of Bath and Wells. I had the honour of rehearsing these two distinguished pupils, and they each accepted a Book of the Music from me as a reward for their keen attention to their studies ! The Processional anthem ""I was glad"" made a splendid effect, the Westminster boys' ""Vivats"" coming in with superb effect. And they had an extra chance also, for in consequence of His Majesty the King not entering the Choir until some time after Her Majesty the Queen, the ""Vivats"" had to be repeated. It was here that the value of Dr. Borland's system of signals, already referred to, was fully revealed, and my precaution in adopting them amply vindicated. The signals to the choir and band worked admirably, and I must add that Dr. Alcock (now organist of Salisbury Cathedral) at the organ extemporised so effectively that the whole affair, which might have proved an awkward moment if not a catastrophe, passed off as if it had been rehearsed as a part of the programme. Sir Walter Pariatt sat on the conductor's platform with me, taking his share in conducting the orchestral music and directing the performance of his own anthem. Concerning my Homage anthem no cut was necessary. The aged Archbishop Temple was a little slower over the ""Homage"" than we had anticipated, the music in its entirety being required to accompany this picturesque function. A striking feature of the ceremony was the Procession of the Regalia, which formed an early and interesting item in the day's proceedings. The Abbey clergy charged to bear the regal symbols from the Jerusalem Chamber into the Church were accompanied in procession by the choir. Traversing the Cloisters, singing the hymn ""Rejoice to day with one accord,"" to the grand old tune ""Ein' feste Burg,"" a pause was made for a short service in Edward the Confessor's Chapel, and another pause near the Chapel of Henry VII., while Tallis's Litany was sung as above described; then, supported by two trumpets and three trombones, the procession was resumed, to the strains of ""O God, our help in ages past."" At the last verse, as the singers comprising the choirs of the Abbey and the Chapel Royal neared the great West door, the hymn was taken up by the Coronation choir and the vast congregation, producing an unrehearsed climax of overwhelming majesty that will never be forgotten by those present.</p>"
0.0,PILGRIM.txt-512,"While speaking of the school, I may as well tell a final story of those old days. At a later period of my school life we were removed to yet another room, in a house inhabited by the school-master in the Precincts. It was a rambling old place, with an enormous roomy cellar. The master was about to punish a boy his own son for some misdemeanour, when the young gentle- man suddenly slipped out of the door, across the hall, and out into the yard at the back. His father, after a moment's surprise, followed him cane in hand, and arrived in the yard just in time to see the culprit dis- appear into the capacious cellar. He felt perfectly certain that his bird was trapped, and followed without undue haste. After a time he reappeared in the school, and to our surprise said, "" Have you seen Willie ? "" "" He went out into the yard, Sir,"" we replied. "" Oh, yes,"" said the master, "" and into the cellar, but I have thoroughly searched and he has most unaccountably disappeared."" I do not remember when the boy reappeared, but his method of escape, somewhat original, was as follows : The master, not long before, had purchased a barrel of apples, which was placed in the cellar. The barrel and its contents had been discovered by his children, and the apples consumed. The empty barrel, well-known to the runaway, he quickly turned over, and as his father, cane in hand, prowled around, the boy within it watched him, with some anxiety, through the bung-hole. Our schoolmaster used the cane pretty freely, and he had one refinement of punishment which was very original, which he would resort to if a boy's fault was very heinous. In his eyes the most serious faults were prevarication and falsehood. One boy was particularly prone to these (I will not give his name, but he became a very good member of society all the same). This boy seemed always to be undergoing verbal reproof for his infirmity, and if in the service there occurred one of the Psalms referring to lies such as the 58th, "" The ungodly are froward . . . they go astray, and speak lies;"" or the loist, ""There shall no deceitful person dwell in My house "" the master would say to the boy : "" Master , did not your conscience prick you ? "" , and the boy always answered "" Yes, Sir."" The method I have referred to, and to which such admonitions were the prelude, was to send the delinquent down the High Street to purchase a good, stout cane with which he was to receive chastisement when he returned ! This occurred more than once in the experience of the same boy who never failed to bring back the cane, so that if he lacked the grace of truth, he certainly did not fail in fidelity. "
0.0,PILGRIM.txt-513,"<p>The first great musical gathering in which I took part was the opening of the Crystal Palace at Sydenham, by Queen Victoria, in 1854. A large choir was formed, which included that of Rochester Cathedral, and I sang in this choir under the direction of Costa. Clara Novello sang the solos in the National Anthem; her clear, beautiful voice still seems to ring in my ears. She put in an ornament on the word 'us' [...] and as she lingered on the high B flat, an old gentleman behind me, a member of the choir, exclaimed enthusiastically, 'That's a beauty!'</p>"
0.0,PILGRIM.txt-514,"Having referred as above to the Rev. W. Shepherd, I must not omit a reference to another Precentor of Rochester with whom I came in contact. Among all such dignitaries whom I have met, his charming face and sweet disposition linger in my memory: he was the Rev. T. T. Griffith (not the Vice-Dean, Dr. Griffiths), and held office during part of the term of my articles. Well endowed with that fine skill and adroitness which we call tact, he was enabled in his dealings with people to get them to do exactly as he wished."
0.0,PILGRIM.txt-515,"<p>And here perhaps I may appropriately tell the story of my ""cabman critic."" I picked him up one night on leaving the Albert Hall, after conducting a concert. He drove me home. I had alighted in Dean's Yard, and was searching in my pocket for the fare, when suddenly he exclaimed, ""Well, Sir Frederick, how did the concert go off?"" I was rather taken aback by this unexpected query, and for a moment hardly knew what to reply. In point of fact, the particular concert was one of a special character. We had given a selection of Wagner, including ""The Last Supper,"" a very difficult work which had not been done in London for, I think, some twenty-five years indeed, very few choral societies had been able to tackle it. Pulling myself together, I said to the expectant cabby, ""Oh, I think pretty fair."" My friend at once replied, ""Well,for myself I don't understand Wagner [pronouncing it in familiar English], he is too abstruse and athematical for me."" This amused me very much, and after a little more conversation I said, ""Well, you know who I am. If you like to look out for me I shall be glad to employ you to take me to and from the rehearsals."" He thanked me, and said he would not forget. True to his word he turned up on the next occasion of a rehearsal. Afterwards I employed him often. He constantly came to the rehearsals, and also to the concerts, and on not a few occasions honoured me by adversely criticising my conducting. For example, he said, after a performance of ""Messiah,"" ""It was very good, Sir Frederick, very good : but what makes you take the 'Hallelujah Chorus' so fast?"" ""Fast,"" said I, ""I didn't take it fast."" ""Oh, yes, you did,"" he observed, shaking his head, adding, as he drove off, ""It may gain in brilliancy by your method, but it loses in majesty. Good-night!""</p>"
0.0,PILGRIM.txt-516,"Maas was devoted to fishing, and helped to stir within me that love for the angler's art which I still indulge. Our most pleasant fishing excursion was to Cooling Castle, with its beautiful I2th century gatehouse, still in an almost perfect state of preservation. The tale of its defence in 1554 by the then Lord of Cobham, against Wyatt's rebellion, was an interesting one to us boys. It was about seven miles from Rochester, and the moat contained roach and carp. We generally made up a party of five or six boys, rewarding the kind residents of the Castle by singing a part-song or two. Maas and I often went to the village of Snodland, where there was a good trout stream. It was in this stream I landed my first trout. I confess it was not with a fly, but the more humble worm ! Other fishing excursions were made to Farleigh, a delightful place above Maidstone, where we would sit all day beside the Medway throwing in huge lumps of ground-bait, and gentles, pulling out as a rule a very good basket of perch and roach. I believe I brought more zest to this sport than is now the case in my sometimes toilsome efforts to land the lordly salmon. Poor Maas loved fishing till the last, and it was a cold caught on a fishing excursion that brought on the illness that terminated fatally in 1886. I composed a tune for, and played the organ at, the funeral service of this dear friend of my youth."
0.0,PILGRIM.txt-517,"<p>In 1910 came the sad calamity of the death of King Edward VII., a National memorial service being held in the Abbey on May 20th. It was attended by an enormous congregation, and was indeed a very solemn and impressive occasion. I selected the music to be performed, and think it will be conceded that it furnisheda programme of deep significance. We played five funeral marches, viz., Schubert's ""Marche Solennelle,"" Purcell's March composed for the funeral of Queen Mary in 1694, and Marches by Beethoven, Tchaikovsky, and Mendelssohn, the last named the E minor, from ""Songs without Words."" The Tchaikovsky number, in C minor, was accompanied by organ only; but in the other items the organ was supplemented by brass and drums. The service commenced with the penitential verses of Psalm 51, as set by Sir John Stainer. These were sung in procession, by priest and choir alternately. An instrumental interlude followed, viz., Beethoven's "" Trois equals"" for four trombones, which, played in the Triforium, had a magnificent effect. Handel's fine anthem, ""The ways of Zion do mourn,"" and Goss's ""The souls of the righteous,"" which I had specially arranged for this service, were sung. The hymn, "" O God, our help in ages past,"" sung very slowly by choir and congregation (except verses five and six, which were sung very softly by choir alone), provided an inspiring moment. Gibbons' Amen the same that had been rendered at King Edward's Coronation completed the service, and I played the Dead March in ""Saul,"" accompanied by brass and drums. Chopin's ""Marche Funebre,"" played by Dr. Alcock, also accompanied by brass and drums, formed an exalted close.</p>"
0.0,PILGRIM.txt-518,"In connection with a chorister's life, I must not omit to mention the visits of Miss Maria Hackett. She was a lady who made it her mission to improve the education and general position of the boys in Cathedral choirs. Her advent was always welcome to us, because we knew that after service we should be paraded, our names entered in her little book, and we should receive a small tip. Her work is well known. I need not dwell upon it here, except to say that she lived to see the education of Cathedral choristers put upon a higher level than it was in my youthful days. Her labours for choristers have been recorded on a tablet erected in St. Paul's Cathedral. Miss Hackett was a regular attendant at St. Paul's, and a little witticism of Sydney Smith's respecting her may be chronicled."
0.0,PILGRIM.txt-519,"<p>In connection with seeking Turle's advice, I will venture to tell a story that reveals Dean Stanley in a new light, that of musical critic. Before being very long at the Abbey it fell to my lot to play the Dead March in ""Saul."" I played it as I had heard Hopkins and other musicians play it, but to my surprise found that the Dean was much disappointed by my performance. I took the opportunity of seeing him and asking him what was wrong. He said it did not sound like the Dead March in ""Saul"" which he had been accustomed to from Turle, nor at all like the Dead March as played by Dr. Buck, of Norwich, which he had heard some thirty years before. I could not help replying that I did not suppose it did sound like Dr. Buck's performance, as I had never heard that Dr. Buck was a capable organist, although an admirable teacher of boys, but promised to take the opportunity of asking Turle what his particular version was. This I did, and soon found that it included the introduction of some remarkable drum effects, which I had somewhat modified.then told the Dean that if he would come and hear me, I would play it again. He came into the Nave one evening, when I gave him a supply of drums far exceeding whatTurle had done (I must admit for that occasion only), and he wrote me a note saying he was quite satisfied. Since then I have played the Dead March many times, and fancy I am somewhat celebrated for my drum effects, although these, I am afraid, are not approved by some of my brother organists.</p>"
